{
  "$schema": "https://json-schema.org/draft/2020-12/schema",
  "$id": "https://acc0mplish/aesthete/schemas/alt.schema.json",
  "title": "Abstract Layout Tree",
  "description": "Domain-agnostic geometry: every visual object is a node with a bbox. The source of truth for all measurement skills.",
  "type": "object",
  "additionalProperties": false,
  "required": ["schema_version", "diagram_type", "meta", "nodes"],
  "properties": {
    "schema_version": { "const": 1 },
    "diagram_type": { "const": "layout" },
    "meta": {
      "type": "object",
      "additionalProperties": false,
      "required": ["title", "canvas"],
      "properties": {
        "title": { "type": "string" },
        "canvas": {
          "type": "object",
          "additionalProperties": false,
          "required": ["w", "h"],
          "properties": {
            "w": { "type": "number", "minimum": 0 },
            "h": { "type": "number", "minimum": 0 }
          }
        },
        "source": { "enum": ["svg", "html", "pptx", "docx", "xlsx", "image", "ooxml", "abstract", "synthetic-ground-truth"] },
        "output": { "type": "string" },
        "note": { "type": "string" },
        "design": { "type": "object" }
      }
    },
    "nodes": {
      "type": "array",
      "items": {
        "type": "object",
        "additionalProperties": false,
        "required": ["id", "bbox"],
        "properties": {
          "id": { "$ref": "common.schema.json#/$defs/id" },
          "label": { "type": "string" },
          "category": { "type": "string" },
          "kind": { "$ref": "common.schema.json#/$defs/nodeKind" },
          "shape": { "$ref": "common.schema.json#/$defs/nodeShape" },
          "bbox": { "$ref": "common.schema.json#/$defs/bbox" },
          "endpoints": {
            "type": "array", "minItems": 2, "maxItems": 2,
            "description": "stroke-path endpoints in world coords [[x,y],[x,y]] — svg adapter: <line> x1..y2 / single-subpath fill=none <path> first·last on-path point. Consumed by vuln anchor-buried; absent on domains without endpoint capture (graceful bail)",
            "items": { "type": "array", "minItems": 2, "maxItems": 2, "items": { "type": "number" } }
          },
          "style": {
            "type": "object",
            "additionalProperties": false,
            "properties": {
              "fontSize": { "type": "number", "minimum": 0 },
              "luminance": { "type": "number", "minimum": 0, "maximum": 1 },
              "opacity": { "type": "number", "minimum": 0, "maximum": 1 },
              "color": { "type": "string" },
              "bg": { "type": "string" },
              "filled": { "type": "boolean", "description": "false for stroke-only/outline elements (e.g. lucide fill=none) — used to skip stroke–stroke crossing 'collisions' in icons" },
              "strokeWidth": { "type": "number", "minimum": 0, "description": "stroke thickness in canvas units (svg adapter: raw stroke-width × transform scale, default 1). collision inflates a thin fill=none connector's bbox by strokeWidth/2 into its real ink band" },
              "role": { "$ref": "common.schema.json#/$defs/role" }
            }
          }
        }
      }
    },
    "groups": {
      "type": "array",
      "items": {
        "type": "object",
        "additionalProperties": false,
        "required": ["id", "members"],
        "properties": {
          "id": { "$ref": "common.schema.json#/$defs/id" },
          "members": {
            "type": "array",
            "minItems": 1,
            "items": { "$ref": "common.schema.json#/$defs/id" }
          },
          "label": { "type": "string" }
        }
      }
    }
  }
}
